{
  "schema_version": "0.1.0",
  "claim_id": "22cd4764-868b-422c-bbbf-f4b635195abe",
  "subject": {
    "id": "HGNC:11998",
    "label": "TP53"
  },
  "relation": "decreases",
  "object": {
    "id": "HGNC:11892",
    "label": "CDKN1A"
  },
  "polarity": "negative",
  "species": "NCBITaxon:9606",
  "cell_context": {
    "cell_type": "CL:0000988",
    "cell_line": "CLO:0009454",
    "state": "IFNG_stimulated"
  },
  "assay_context": {
    "assay": "CRISPRi_screen",
    "perturbation": "CRISPRi:HGNC:11998"
  },
  "evidence_ids": [
    "perturbseq_v_test:d49956eb4b0f4a73"
  ],
  "confidence_language": "supported",
  "requested_status": "hypothesis"
}
